<?xml version="1.1" encoding="UTF-8" standalone="no"?>
<!DOCTYPE Informe SYSTEM "Ejercicio9.dtd">
<Informe>
 <Descripcion>Informe mensual de seguros de clientes registrados.</Descripcion>

  <Seguro tipo="Edificio">
    <Numero>SEG-001</Numero>
  <ClienteP>Juan Pérez</ClienteP>
  </Seguro>

  <Seguro tipo="Contenido">
    <Numero>SEG-002</Numero>
    <ClienteE>Construcciones Méxicas S.A. de C.V.</ClienteE>
  </Seguro>

  <Seguro tipo="Contenido">
    <Numero>SEG-003</Numero>
    <ClienteP>Ana García</ClienteP>
  </Seguro>

  <FechaInforme FechaInicio="2025-01-01" FechaFin="2025-01-31"/>
</Informe>